author,author_flair_css_class,author_flair_text,body,controversiality,created_utc,distinguished,edited,gilded,id,link_id,parent_id,retrieved_on,score,stickied,subreddit,subreddit_id
lostswansong,,,"I'm praying right there with you OP. I'm autistic and my NMom has cancer so not only can I not take care of myself but I have to take care of her while she berates me and breaks me down whenever she gets the slightest opportunity to hurt my feelings or dismiss my pain. I have several chronic health issues and diseases because of the constant state of inflammation my body is in due to the stress and trauma of having these evil people in my life.

Please God allow these evil people to be removed from me and OP's life. I don't know if there's a God but I'm praying so hard with all of my might. Help us get a way out God please.",0,1719821871,,,0,lb3kcal,t3_1dsjp17,t3_1dsjp17,1719821888,10,False,raisedbynarcissists,t5_2we9n
Decoynoodles,,,"Babe it’s time to think what is really important to him and what you want out of life. My mom was with my dad for 22 years and almost 15 years after their divorce he’s still doing the same stuff. 
Did he even say sorry? I’ll pay you back? Nothing? My ex was an alcoholic, he was horrible we were together 8 years. It just got worse until he had liver failure at 25ish because he also had a medical issue and towards the end he was stealing my medication for cancer pain and mixing them with alcohol. If we had had kids or bought a house the split (he called me and told me to get out after I went to the hospital everyday and took care of him) would’ve been so much harder on me. I would think about that if you do choose to stay and give him more chances. I never looked back and I’m in a happy relationship with child now and neither of us drink.",0,1719821965,,,0,lb3kgyg,t3_1ds5ugz,t3_1ds5ugz,1719821980,1,False,AmIOverreacting,t5_4uoy2u
TCBguy1,,,"Drugs…… my sister has been an addict for most of her adult life. She has missed the funerals of her grandparents, parents, and 2 siblings. She only reaches out when she wants money, lied about having cancer (to guilt me into giving her money for “medicine”) and then tells me what a horrible brother I am for not being there for her. Sometimes you have no choice but to cut ties. It’s sad, as we used to be close. I have a family and will not subject them her toxic ways. I do wish things were different, but I feel that it was her choices that lead to our current relationship, not mine.",0,1719822474,,,0,lb3l60h,t3_1ds1mk6,t3_1ds1mk6,1719822492,2,False,AskReddit,t5_2qh1i
highoninfinity,,,"golden - fall out boy

oceans - frank iero

this isn't about suicide but about a mother who lost her 4 year old son to cancer, it makes me cry every time: ronan - taylor swift",0,1719822477,,,0,lb3l65y,t3_1dqpj8z,t3_1dqpj8z,1719822492,1,False,musicsuggestions,t5_2tb5e
Dull_Professional622,,,"I'm so sorry for your loss 💔💔

I hope you don't mind me asking, did she get the covid vaccine? 

I have had 2 family members and a further 2 acquaintances diagnosed with aggressive cancer in the last 2 years. Youngest was 27, oldest was 53.

Everyone I speak to knows of at least 1 person the same. 
It's really making me wonder",1,1719822534,,,0,lb3l8zg,t3_1ds70vh,t1_lb0wvbj,1719822548,1,False,Biohackers,t5_2vnoe
beansproutsarecute,,,"I’m so sorry OP :( my deepest condolences. I’m 24 and my mom has terminal cancer too, she’s still around but I dread the day she wont be. It sucks it really really really does and it’s gonna suck for a while. I’m also so sorry you have to go through this at 18, I’m sorry you had to grow up so fast - you should have been able to enjoy your youth for longer, and to have your mom by your side. 

Are there any family members or friends you can lean on for support? Just to be with you and spend time with you so you don’t feel too alone? Try not to isolate yourself, even if you feel like nobody understands how you feel! There are people who really care about you and love you.

But that said, take alllll the time you need to process and reflect alone too. It’s okay to not be okay, and I think healing and grieving isn’t a linear process either, there’ll be good and bad days. 

Take it one step at a time, one day at a time. And know that your mom wouldn’t want you to be miserable forever, so when you’re ready, go out and enjoy life, taking your memories of her with you. Know she’s smiling down at you from above ❤️

Sending so much love and hugs to you!!! :”",0,1719822644,,,0,lb3lefu,t3_1dsmgr1,t3_1dsmgr1,1719822661,5,False,CancerCaregivers,t5_37mbk
Connect-Mastodon1798,,,May Allah grant your father complete shifa and bless him with a quicky and complete recovery Ameen. If you can please make dua for my sister who is undergoing treatment for cancer for the second time that may Allah grant her complete remission this time. JazakAllah,0,1719822909,,,0,lb3lrjo,t3_1dsluug,t3_1dsluug,1719822935,5,False,islam,t5_2qhbp
AwfAwfAwfAwfAwf,,,Can’t help falling in love. All versions but especially the twenty one pilots cover. I had a huge cry when they played it live for the emotional roadshow tour. I can sometimes get through Cancer and Legend without crying. Both remind me of my two grandmothers who died years apart,0,1719822924,,,0,lb3lscg,t3_1dp4c3x,t3_1dp4c3x,1719822941,1,False,twentyonepilots,t5_2u0fp
The_Sunginator,,,"My friend laughed about my Dad’s fiancé dying the exact moment I found out. 

I was in school and a teacher randomly came in with my twin sister, and both of them were crying and asked to have a word with me in private. 

Stepped out and was told she passed from a very aggressive brain cancer that was kept hidden from me and my sister because my dad was worried we’d be upset. 

I didn’t get on well with my twin sister (and still don’t) - but I’d never saw her so upset before, and naturally the whole thing made me very upset too.

Came back in class and my mate immediately asked if my sister was crying because ‘they ran out of food in the cafeteria’ (she was heavy) - so I told him what actually happened and the full class went completely dead-silent. 

POS then doubled-down and asked if she ate my dad’s dead fiancé and I just completely lost it. 

Slammed his head on the desk, which broke his nose - and then I just silently left and cried the full walk home.

Thought I’d get expelled or suspended but the teacher in that class saw the whole thing and vouched for me apparently.

Needless to say that guy wasn’t a friend after that, and once word spread he basically lost all his other friends too.",0,1719823196,,,0,lb3m5nb,t3_1dsno41,t3_1dsno41,1719823213,3,False,AskReddit,t5_2qh1i
ParkingPsychology,badge,Elder Sage [4922],"> Help me see logic and overcome my obsessive fears about bowel/colon cancer please

[Here's a 2 minute test](https://www.anxietycentre.com/tests/anxiety-disorder-test) you can take. It let's you know roughly where you rank in severity (if it comes back relatively low, it might be social anxiety, for example).

[Here are a few things that you can do to help you with anxiety](/r/Anxiety/wiki/onlineresources). It comes down to meditation, breathing exercises and using apps to reduce your anxiety.

You can double check if it is indeed anxiety here: [11 Signs and Symptoms of Anxiety Disorders](https://www.healthline.com/nutrition/anxiety-disorder-symptoms)

If you feel anxious right now, [open this image](https://i.imgur.com/Huou7Gh.gif) in a new tab and start breathing in and out in the rhythm of the image. [More about box breathing.](https://www.healthline.com/health/box-breathing)

If you currently consume a lot of caffeine (in coffee or soft drinks), stop that. [Caffeine is known to cause anxiety](https://bebrainfit.com/caffeine-anxiety/)

The best and quickest way to deal with anxiety, is to face your fear if possible.

[If you always avoid situations that scare you](https://www.mentalhealth.org.uk/explore-mental-health/publications/how-overcome-fear-and-anxiety), you might stop doing things you want or need to do. You won't be able to test out whether the situation is always as bad as you expect, so you miss the chance to work out how to manage your fears and reduce your anxiety. Anxiety problems tend to increase if you get into this pattern. Exposing yourself to your fears can be an effective way of overcoming this anxiety.

*[The experience of anxiety involves nervous system arousal.](https://www.psychologytoday.com/us/blog/insight-therapy/201009/overcoming-fear-the-only-way-out-is-through) If your nervous system is not aroused, you cannot experience anxiety. Understandably, but unfortunately, most people attempt to cope with feelings of anxiety by avoiding situations or objects that cause the feelings. Avoidance, however, prevents your nervous system from getting used to it. So avoidance guarantees that the feared object or situation will remain new, and hence arousing, and hence anxiety provoking. Even worse, avoidance will generalize over time. If you avoid the elevator at work, you will soon begin to avoid all elevators, and then all buildings that house elevators. Soon enough, you'll be living in a prison of avoidance.*

If your anxiety is situational and not too extreme, you can try to address it through exposure therapy. You slowly expose yourself to situations that you know gives you fear. Here are two easy to follow guides on that. The one regarding spiders, is a blue print, you can replace spider with anything, fear of driving, fear of using a phone, anything.

* [How to Overcome the Fear of Spiders](https://www.wikihow.com/Overcome-the-Fear-of-Spiders) (wikihow)
* [How to Overcome Fear](https://www.wikihow.com/Overcome-Fear) (wikihow)

Overthinking:

* [How to know/what to do: Overthinking](https://www.verywellmind.com/how-to-know-when-youre-overthinking-5077069)
* [Intrusive Thoughts and Overthinking: The Skill of Cognitive Defusion](https://www.youtube.com/watch?v=V3vhXQy48jo) (youtube, 1.2M views)

For the below advice, use technology to your advantage. Take your phone and set repeating alarms, with labels of what to do. Train yourself to either snooze or reschedule the reminders if you can't take action right away, but never to ignore them. The intention is [to condition yourself](https://www.cleverism.com/classical-conditioning/), to build habits, so you will start healing yourself without having to think about it.

* **Sleep**: [Good sleep is very important when treating anxiety](https://www.anxiety.org/sleep-a-fundamental-cure-for-anxiety)
When you have days where you don't have to do anything, don't oversleep, set an alarm clock. You really don't need more than 7 hours at most per night (a [little more](https://health.onehowto.com/article/how-many-hours-of-sleep-are-needed-per-night-by-age-8233.html) if you are under 18). If you can't fall sleep, try taking melatonin one hour before going to bed. It's [cheap](https://www.amazon.com/dp/B003JJ9TQA/), OTC and [is scientifically proven](https://www.webmd.com/vitamins/ai/ingredientmono-940/melatonin) to help regulate your sleep pattern. [Also, rule](https://www.webmd.com/sleep-disorders/sleep-apnea/news/20120330/sleep-apnea-linked-depression#1) out [sleep apnea](https://www.healthcentral.com/article/sleep-apnea-treatment-resistant-depression). Up to 6% of people have this, [but not everyone knows](https://www.webmd.com/sleep-disorders/sleep-apnea/features/sleep-apnea-clues#1). If you find yourself often awake at night, start counting. Don't grab your phone, don't look at the clock, don't do anything interesting. We're trying to *bore* you to sleep, not keep you entertained - sometimes it might *feel* like you've done it for hours and hours, but often it's really not all that long. Anytime your mind wanders away from the numbers and starts thinking, start over at 1. count at the speed of either your heartbeat or your breathing, whatever you prefer. Then both Alexa and Google Home can also play a range of sleep sounds if you ask them (rain or other white noise) and there are also free apps for both Android and Apple devices.
* **Meditate**: [Anxiety can be reduced with meditation](https://bebrainfit.com/meditation-anxiety/). [10 minute meditation for anxiety](https://www.youtube.com/watch?v=O-6f5wQXSu8) (youtube). 
Your attention is like a muscle. The more you train it, the better the control you have over it. [Mindfulness training](https://www.mindful.org/meditation/mindfulness-getting-started/) will help you gain better control over your mind. It doesn't take much effort, just 15 to 20 minutes a day of doing nothing but focus your attention is enough and is scientifically proven to work. As you become better at focusing your attention, it will become easier to force yourself to stop having negative thoughts, which will break the negative reinforcement cycle. Go here if you have specific questions: /r/Meditation
* **Exercise**: [The effect of exercise on anxiety](https://www.calmclinic.com/anxiety/treatment/exercising) 
If you have access to a gym, then start lifting weights. If you don't have access to a gym (or you don't like lifting), start running. If you can't run, then start walking. Just start small. 10 minutes three times a week is fine. You don't have to run fast, just run and then slowly build it up over time. Exercising does several things: It releases endorphins, it takes your mind of your negative thoughts and it will improve your overall health.
* **Give lots of hugs**: [Hugs release oxytocin](https://health.usnews.com/health-news/health-wellness/articles/2016-02-03/the-health-benefits-of-hugging), which improves your mood and relaxes you. So find people to hug. If you are single, hug your parents or friends. If you can't, see if a dog is an option. Most dogs love to hug. Another solution that provides the same benefit is a [weighted blanket](https://www.amazon.com/s?k=weighted+blanket) will provide a [similar positive effect at night](https://www.healthline.com/health/anxiety/do-weighted-blankets-work#benefits). [You should try to aim for 12 hugs a day](https://psychology-spot.com/brain-needs/) (if you currently don't hug a lot, I suggest you slowly build it up over time).

Highest rated books for anxiety self help:

* [The Anxiety and Phobia Workbook](https://www.amazon.com/Anxiety-Phobia-Workbook-Edmund-Bourne/dp/1626252157/) (4.6 stars, 1200+ ratings)
* [Dare: The New Way to End Anxiety and Stop Panic Attacks](https://www.amazon.com/Dare-Anxiety-Stop-Panic-Attacks/dp/0956596258) (4.7 stars, 1600+ ratings)
* [Badass Ways to End Anxiety & Stop Panic Attacks! - A counterintuitive approach to recover and regain control of your life](https://www.amazon.com/Badass-Ways-Anxiety-Panic-Attacks/dp/9090305262) (4.7 stars, 400+ ratings)

[Be aware that anxiety can be addictive](https://www.psychologytoday.com/us/blog/emotional-freedom/201104/are-you-addicted-anxiety-learn-how-not-be):

>I've seen that many people are addicted to the adrenaline rush of anxiety, known as ""the fight or flight response"" and don't know how to diffuse it.

[Frequent consumpton of news can increase anxiety](https://www.tandfonline.com/doi/full/10.1080/00332747.2015.1069658).

Best phone apps:

* FearTools - Anxiety Aid
* Calm - Meditate, Sleep, Relax

Instructions on when and how to get professional help: /r/Anxiety/wiki/gettinghelp

[Anxiety self help by the Australian Health Service](https://www.cci.health.wa.gov.au/Resources/Looking-After-Yourself/Anxiety). [Worry and Rumination Workbook](https://www.cci.health.wa.gov.au/Resources/Looking-After-Yourself/Worry-and-Rumination)

Best Videos:

* [Generalized anxiety disorder (GAD) - causes, symptoms & treatment](https://www.youtube.com/watch?v=9mPwQTiMSj8) (1.2M views)
* [3 Instantly Calming CBT Techniques For Anxiety](https://www.youtube.com/watch?v=JiDaTi_iQrY) (850K+ views)
* [5 Easy Tips to Beat Anxiety!](https://www.youtube.com/watch?v=0GgsV2nKL9w) (260K+ views)

Free support options:

* /r/KindVoice will match you up with a volunteer that will listen to you.
* https://www.7cups.com has both a free trained volunteer service as well as $150 monthly licensed therapist option
* If you are in a crisis and want free help from a live, trained Crisis Counselor, text HOME to [741741](https://www.crisistextline.org/texting-in)

Subreddits: /r/Anxiety and /r/Anxietyhelp",0,1719823401,,,0,lb3mfo4,t3_1dsm42a,t3_1dsm42a,1719823417,1,False,Advice,t5_2qjdm
luxsatanas,,,My mother before cancer (during covid) vs after cancer. It's amazing how chemo during an epidemic will highlight all the problems that have been swept under the rug for years,0,1719823954,,,0,lb3n6ys,t3_1ds8bhr,t3_1ds8bhr,1719823969,5,False,CPTSDmemes,t5_oa0fa
heysweetcaroline,,,"Thanks for adding that you don’t know the context - I don’t have two Berners, we have the dam and our friend has the sire. We decided to breed because another friend really wanted a Berner as a service dog for their child but can’t afford the training fees and the high cost of a puppy. 

Both dogs are in great health and were thoroughly examined by our vets prior to breeding with the exception of a full radiological and genetics panel.

If you prefer to purchase a $3-$5000 dog that lives a lonely life in a kennel and are solely used for breeding (which is often the case I’ve experienced with “professional breeders”), but atleast they have their testing that shows they might be a little less likely to have cancer or hip dysplasia (which are already well known conditions with the breed) 🤷‍♀️, that is absolutely your choice - that may not be a requirement for every family. 
Both dam and sire are well loved family pets that we don’t plan breeding regularly, if at all after this litter, so providing well loved and socialized puppies with good temperaments for family pets. We have no intentions of professionally breeding, this was simply the result of trying to help a friend and we know there are others looking for puppies that don’t have the funds that we would need to charge if we invested in full testing.",0,1719824039,,,0,lb3nb4u,t3_1dsht3d,t1_lb30sgr,1719824063,-1,False,bernesemountaindogs,t5_2sx7v
SmotherOfGod,,,"This sounds very concerning. I don't know why they haven't checked the pleural fluid for cancer. It's a common site of metastasis, even in early stage, and her symptoms certainly fit. 


For comparison, I had a much more invasive surgery than your mom (2 lobes removed, open thoracotomy with a 14-inch incision) and after a month I was mostly healed. I do still have a minor heart problem and breathing difficulties but nothing like what your mom is struggling with. 


And unfortunately, mets can indeed happen that fast. I had another spot pop up in my lung 3 months after surgery with clean margins.",0,1719824070,,,0,lb3ncq7,t3_1dslvve,t3_1dslvve,1719824085,6,False,lungcancer,t5_34m9f
Puzzleheaded_Ice6438,,,This is not true unless family history of thyroid cancer.  Been on OZ for years with Graves.,0,1719824115,,,0,lb3nf1c,t3_1dr16n1,t1_lasjjm8,1719824130,1,False,gravesdisease,t5_2wrar
groovykismet,all,ALL THE SYSTEMS,"I love that. What great memories to have. I have a brain tumor, non-cancerous but huge. I’ve already had surgery to remove most of it and then a year later radiation to shrink the rest. I go for my one year post-radiation follow-up next week. I bought my daughter and I suede rollerskates the Christmas before I was diagnosed but I haven’t had the opportunity to take them out for a spin yet. Because my daughter knows that I’ve been wanting to do something ‘exciting’ she bought a copy of Just Dance. lol…We’re supposed to play it together sometime in the next week or two. 

I believe my prognosis is good. This year I’m dealing with the fallout from the 6-weeks of radiation to my pituitary gland which the tumor was wrapped around; my body is no longer making crucial hormones so I’m having to take replacement meds for the rest of my life. The surgery was easy, the radiation was doable but this year has been a little tougher. Being able to do things with my daughter has been everything. She quit her job to be able to help get me back and forth to and from appointments and to just help me navigate this crazy time. I’ve always been a single mom with just the one daughter so our relationship is especially wonderful.

Seeing your post just kinda brought it all home for me. I’m so glad that you’re able to share some of your most precious times with your daughter; I’m absolutely positive it meant everything for her at the time, and even now. It’s so interesting how we can share things with complete strangers and not exactly know how it will affect someone else’s life…very ‘kismet’.

I just bought RDR for my Switch a few weeks back; I haven’t played it yet but when I do I know I’ll be thinking about you and your daughter.",0,1719824249,,,0,lb3nlsq,t3_1dscx83,t1_lb3ln4r,1719824265,6,False,GirlGamers,t5_2rfec
legodoom,,29 | FTM | 🌈🌈🌈🌈 02.24✨,"CW: multiple losses:

Well, my husband and I were HS best friends— we didn’t start dating until 6years after we graduated, and he is truly a gift from God. 🤍✨ I’m the luckiest girl in the world to be married to him now for over 5 years. 

Let me start with this: my husband and I were celibate before we got married, so I want on BC when we were dating. I didn’t want children right away because I wanted to enjoy our marriage. Fast forward to  9 months married (Dec 2019) and I had to come off of my BC because of some adverse reactions. (Vision impairment, awful mood swings, non existent periods— I was worried) My first cycle post BC was strange, I was late, and had all of the classic pregnancy symptoms… but I was not.

The idea of being pregnant and starting a family with this wonderful man planted a seed; I now wanted to start trying. My husband was ready the second we got married, so we started trying. Then 6 months go by and I am diagnosed with endometriosis. I’d always had it for as long as I remembered, but I thought it was normal. I was always told anytime I complained about the intense pain that “all girls go through it, and I just needed to toughen up”. So I learned to cope.

So a year from my diagnosis I had surgery. Things went well, my surgeon was awesome, and we kept trying. But nothing. By the start of 2022 my marriage was having some growing pains, my Omi (grandmother who I was very close to) had just died of cancer and still no pregnancy…. Until the end of February came. We had been trying for almost 2 years, and finally we got pregnant.

We lost that baby and 2 more.(I had lost a baby two years prior to my husband and I dating)
With a total of 4 miscarriages under my belt I was losing hope. I was spiraling. My normal cheery attitude was sullen and listless. The journey was sucking the joy out of me. I wanted to give up on children, but by some miracle, on Jun 13 at 3w+3days at 5:30 in the morning I took a pregnancy test, because that’s just what I do every month… this one was digital, and my period was more than 4 days away— I laid it down hating myself for even taking it “knowing it would be negative”, when suddenly— “PREGNANT” flashed up on the screen.

I sobbed, terrified this could mean another miscarriage… my husband heard me through his sleep crying, and came to me and I told him. He held me and told me that everything would be okay. 

And here we are. 4.5 years of trying, and 4 total pregnancy losses. This pregnancy is unlike anything I’ve ever experienced, so I’m feeling very hopeful. I think the Lord is using this experience to pursue me in a way I’ve never felt so pursued. It is truly magical in every way. 

I feel blessed and lucky to just even be here. I’m 6 weeks today and I’ve lost most of my babies between 6-8weeks but I’m just feeling peace. 🤍✨",0,1719824258,,,0,lb3nm8h,t3_1dsgg53,t3_1dsgg53,1719824273,5,False,February2025Bumps,t5_685jqj
Winter-Ad6945,,,"I’m sorry this happening to him.  Before the pathology can be figured out, the mass needs to be identified through a biopsy.

Regardless of whether the vaccine is responsible for this mass (which it could be) it is something that needs to be resolved.  The good side of this issue is that tumors in kidneys are less likely to metastasize and spread all over the body…the prognosis is pretty good.

The studies are just coming out now with adverse side effects connected to mRNA injections.  The injections were stated by many to never leave the injection site.  

They did.
Spike proteins presented on cells throughout the entire body and continued to do so for over a year after the initial injection in pathology reports that are consistent.

Many studies are underway and not out yet.

Your question about vaccines and kidney problems is a valid question…the answer is not entirely known yet.

I hope it gets resolved and he is able to make a full recovery.  My cousin had a huge tumor on his right kidney…as big as it was, and cancerous as it was, it didn’t metastasize.  He had a surgery to remove the entire kidney that was more tumor than healthy tissue and made a full recovery after a short period of time.  The reason the cancer occurred was never determined.  This was decades before Covid and mRNA “vaccines” to all.",0,1719824416,,,0,lb3ntzi,t3_1dsc82v,t3_1dsc82v,1719824430,0,False,unvaccinated,t5_4c46db
jaimecorona,,,"Thanks for giving concrete examples. 

At work for example, in Europe, at Amazon. There are women’s month and talks and support against cancer. The same for the LGBT people. Mother’s Day, women’s day…

But I’m a normal guy and never received any kind of… anything.",0,1719824471,,,0,lb3nwr0,t3_1ds1vm6,t1_lb3jao6,1719824485,6,False,europe,t5_2qh4j
