author,author_flair_css_class,author_flair_text,body,controversiality,created_utc,distinguished,edited,gilded,id,link_id,parent_id,retrieved_on,score,stickied,subreddit,subreddit_id
oryxmaedchen,,,"I had a maybe similar situation. I was sheduled for op and until then my gyn said maybe we will go laprascopic. But only 6 days pre op my opgyn said they had a op team discussion and every single one involved in the op pre-meeting voted for abdominal. 
In the first moment I was shocked because I thought I surely will have it laprascopic. But then my op elaborated the decision to me and I very much could accept the decision, because for me it was the better decision. (in my case very big fibroids and suspected cancer, they already had extra team on standby, and my op could abdominal been done much quicker and somehow with better options. My team really wanted to avoid starting laprascopic and changing to abdominal.)
Maybe my experience can help you in your situation. Sorry you have this situation. All the best to you.
And if it helps, my abdominal was overall easy and smooth and ist 1y past now.",0,1719851669,,,0,lb5cw4l,t3_1dswat6,t3_1dswat6,1719851686,10,False,hysterectomy,t5_2x8iq
Icy_Cat4821,,,"Taylor and Swift. I’m totally kidding lol, according to other tweets the names are Ronan (TS wrote the song called “Ronan” in 2012 based off the blog of a mom who lost her child in 2011, a son named Ronan, to cancer) and Juliet, reference to her song Love Story from way back, late 2000s.",0,1719851804,,,0,lb5db26,t3_1dsk10n,t1_lb58en0,1719851820,7,False,travisandtaylor,t5_9yjxwy
InspectorWorldly7712,,,"Anecdotal observations are not facts. I would love to see a controlled peer reviewed study that talks about PTSD, CPTSD and BPD being on a spectrum. I enjoy having educated discussions and if you want to share, I’d love to reas your answers to my questions on this topic: 


1) Where are all the other pathologies that are also seen as trauma-based like OCD, GAD, NPD in that spectrum? Why is this spectrum only PTSD/CPTSD/BPD?
2) CPTSD and PTSD are similar and at the same time very different. You can have PTSD over 5 different things and it will still NEVER become CPTSD so that part of the spectrum doesn’t really make much sense. What definitions are you using for PTSD, BPD and CPTSD for the spectrum theory?
3) I was the FP to a deranged man with BPD and the scapegoat to a mother with NPD. I was beaten by my father for 28 years. The last time he beat me was the year he killed himself in front of me. I was molested by my brother for 4 years. I was neglected and abused in ways I can’t even put into words. I had cancer 2x. I was terribly bullied in school. I was raped by a guy my mom sent me to ask for a “loan”. There’s more, but let’s leave it at that. If you need more than that to get BPD, my god, how are there that many people with BPD out there? How much do you have to be abused to get BPD? Not to mention, that many people with BPD don’t even have PTSD or CPTSD. Where are those PwBPD in your spectrum?
3) If it’s in terms of symptoms, core-fear and/or attachment styles, that again, makes no sense. How are those on a spectrum when the ones that define BPD (unstable sense of self, reckless behavior, fear of abandonment, explosive emotions, anger management etc.) are not things that define PTSD/ CPTSD? What, exactly defines the spectrum you speak of?",0,1719851863,,,0,lb5dhod,t3_1cwdp2r,t1_larfdqg,1719851880,1,False,CPTSD,t5_2vvid
Anarchissyface,,,"Yes this is the lie that the U.S pushes and some people actually believe it. 

My mother was lucky enough to take a retirement package at 57. Which means her government health insurance continued until she was 65.

Thank god she did because within a year of retiring she had to take care of grandpa who gradually got dementia. 

She had just married my delusional much older  stepdad about 6 years earlier and were talking about flying around the world when they were in their 60s. Which never happened because she spent it taking care of grandpa. 

So anyway when grandpa finally passed at 92 she was 67. She was probably thinking that finally she’d get to enjoy some of her free time. 

She got cancer and died at 68.😐


The American system pushes such a pipe dream. They tell people save for retirement because we won’t take care of any of  your basic needs along the way like the rest of the developed Western World. So you can’t save enough to retire until you are 60 anyway. 

My mother was 40 when she adopted me so I’m much younger. My mom and grandpa died within a year of each other. The two last people closest to me that raised me. 

I don’t know what I’m doing with the money they left me but I’m definitely enjoying my life while I can after watching that.",0,1719851960,,,0,lb5dsfj,t3_1dstt3q,t3_1dstt3q,1719851976,1,False,MiddleClassFinance,t5_26nzo2
JTBSpartan,,,"My eighth grade science teacher would’ve loved to hear this. He was a great friend of my family, and sadly passed away in 2016 due to brain cancer. Our class knew he had it because he had to take a pretty lengthy leave of absence for treatment.",0,1719851977,,,0,lb5duau,t3_1dsq646,t3_1dsq646,1719851994,1,False,tech,t5_2qh48
GummieVites,,,Pretty sure diabetics have a higher risk of pancreatic cancer regardless of GLP1s... probably anyone with insulin/metabolic issues too which includes those with PCOS and obesity. I trust my endo and if she had noticed any of what your doctor is saying there is no way she would have prescribed this.,0,1719852190,,,0,lb5ei0h,t3_1dswon7,t3_1dswon7,1719852208,61,False,tirzepatidecompound,t5_9gccwk
AMCreative,,SAG-AFTRA | TV/Film,"Couldn’t disagree harder. Let’s dissect.

“Look at all of these people who never took a class”

This is a logical fallacy called “Survivor Bias”. Other examples are Bill Gates and Steve Jobs never having gone to college.

“I have taken 5 classes and only 1 was decent”

This is a statistical error centered around sample size.

If I told you I had a medication that cured cancer because 5 people took it and 1 went into remission would you trust that pill?

“I could have learned all of these things on my own”

And you should. IMO classes and self-motivated learning are independent tracks. One augments the fruits of the other.

“Long time students with the teacher have no credits”

And? 95% of actors don’t make a living acting. That’s the likelihood of you pulling any actor out of the wind and checking their credits, not just long term actors with a coach.

Further, and you should know this as a business major, acting classes rarely teach explicitly acting business strategy and entrepreneurship. So skills like marketing, networking, leadership, strategy, etc, aren’t regularly a part of a classes curriculum (though it does appear in an ad hoc manner).

Lastly, as someone who has taught a class, most students… don’t do the homework. Seriously.

Should that be the teacher’s fault?

“I’ve had acting coaches tell me I’d never book a co Star then I did”

Yeah I agree with you that that person sucks. Coaches should be inspiring and motivational and help you reach new heights.

“Coaches don’t want people to be successful because they won’t study anymore”

Such a highly cynical take. Use your business background to disprove it yourself. Hell read your last paragraph. A successful visible student is a marketing opportunity, which begets more business, full stop.

You’re not even thinking your arguments through now.

“I’ve been on sets where a director fired an actor for using a technique”

Then that actor may not have been ready.

There are definitely some situations where an actors technique can put them in a hole (it’s something I am highly aware of when I do mentor brand new people), but it’s on the actor to know when to peel back or try something different, not the coach.

—-

It feels like you’re treating acting classes like there is only one true way, and you should be treating it like Bruce Lee treated martial arts dojos: take from a class till you don’t see what you can learn from them, and move on. Develop your actor version of Jeet Kun Do.

For me it’s always been that or a lab, where I go to test and hone my skill. I’m at the point where, generally, I don’t learn much or get notes back on my performances, no matter who the teacher is, but the activity of being around peers and continuing to practice my craft weekly with others is useful on its own.

Cheers.",0,1719852225,,,0,lb5elxu,t3_1dsvr48,t3_1dsvr48,1719852241,22,False,acting,t5_2qyft
H47,pennant teamzenith,,Bet he can kiss his kids goodnight before wishing cancer on my mother.,0,1719852249,,,0,lb5eoo7,t3_1dsg2d7,t1_lb2hg2r,1719852265,-1,False,DotA2,t5_2s580
dontgiveatuck,,,"I want what’s best for Brad, and hope he’s doing okay. I get that it seemed like the right thing to do in the moment, but he made a mistake by removing the photos. 

Based on Brad’s tweets, he’s not super familiar about the I/P conflict and the absolute cancerous discourse around it since October 7th. A few years ago, people reserved the term “Zionist” to refer to religious extremists in Israel that wanted to continue building settlements in the West Bank, but extreme pro-Palestine advocates have extended the definition to include anyone that thinks Israel has a right to exist. Nowadays, if you’re labeled as a Zionist, the connotation is that you support Palestinians being completely wiped from the West Bank and Gaza, when in reality you may just think Israel has a right to exist. Believing that Israel has a right to exist is a perfectly normal position to have - in fact, a vast majority of American Jews think it should. It has gotten to the point that the word “Zionist” has become a derogatory term for Jews.

Ethan and Hila are very pro-Palestine and the only “crime” they’ve committed is that they are Israeli citizens and because they believe Israel should exist and that October 7th was an atrocity - again, belief a vast majority of Jews share. I see the attacks on H3 accusing them of being extreme “Zionists” as a complete mischaracterization of their beliefs and as blatant antisemitism. Many (if not all) the claims made toward Ethan and Hila are either a gross mischaracterization or are downright false. Lots of bad faith actors have pushed this narrative because said actors will accept nothing less than the dissolution of Israel.",0,1719852345,,,0,lb5ezho,t3_1dsfyjk,t3_1dsfyjk,1719852362,2,False,BradTasteInMusic,t5_3az5hs
Financial-Win7421,,,"She straight up killed her brother who was a good person for her own selfish reasons. When she says, ""I would not be controlled by that thing"", it doesn't sound like she did it from a place of doing it for the greater good, she did it in a form of rebellion, she wanted to be independent herself. It was just purely selfish motives.

I'm not even sure that her plan to remove the two finger's influence over The Lands Between comes from a good place. Knowing Ranni it's probably more of a move to stick it to em rather than doing it for the good of all mankind.

Hell when you think about it she's planning on leaving and letting all the common folk chill out locked in a cage with super cancer, the one that *she created*.",0,1719852376,,,0,lb5f2zg,t3_1dssozx,t1_lb5c6jh,1719852391,-5,False,Eldenring,t5_122hf1
Maple_Person,,,"> schizophrenia

While true, that’s a wild leap to go from someone losing interest in friendships for 4 months to schizophrenia. It’s like google’s headache —> cancer.

Really could be anything from depression to anxiety, to PTSD, prolonged stress, shitty sleep or poor physical health, feeling burned out from something, etc.",0,1719852489,,,0,lb5ffoy,t3_1dsdnvf,t1_lb1p1wi,1719852506,2,False,Schizoid,t5_2qxro
DesperateGain9038,greyandwhite ,Rules Lawyer,"The DM is terrible and if anyone but his partner question him he pouts and makes a scene, while she brings the game to a standstill to argue with him and just ignore what he's saying. It is extremely uncomfortable for everyone. I mentioned this in another comment but we love rules, and know the rules we made a decision to let him run the game and to let the game happen because playing was more important and our availability is limited.

So I was trying to be vague but our child has Rhabdomyosarcoma (bladder cancer). 

It's important because what little time we have we chose to spend with them playing DND, our family decided to treat us like shit for reasons we don't know. It's important because even with all that we showed up prepared, happy, smiling, inclusive, and trying to not make our problems ruin anyone else's game night. 

  
We have other kids to take care of and finding child care to go play a game on a consistent schedule is almost impossible for us. The time we have free we spend with him and our other kids, so yea, we'd love to find another group but finding a new play group is hard, it's really hard for us. 

Do you think we haven't been depressed during this? We aren't ignorant or being insensitive but only an asshole makes it everyone else's burden. Only a selfish person makes everything about them. 

They haven't called any of us for months to check on us see if we're doing okay, they haven't been here for us when we've asked them for anything.   
Every time we see them she has to say something is making her sad, something bad happened to her. Yea people can be sad, and talk about being sad and I honestly didn't realize what she was doing for a long time.  So the comment she made about ""no one at work said anything to me about my work anniversary"" looking at me pouting, but her eye's were just empty and it was so stupid, so self obsessed. So her first decision is to try and make us feel bad for her, like every time, this time what she said was so stupid it felt like i was looking at a pyscho and not my sister. It gave me clarity that she doesn't feel empathy anymore. 

She went to far with her bullshit and we realized she's been fucking with us. It was unhinged.

  
I don't understand any of this and it just happened. We are still in shock. I apologize if this came off aggressive.",1,1719852491,,,0,lb5ffuv,t3_1dsp5l5,t1_lb4blfh,1719852506,7,False,rpghorrorstories,t5_3fk9d
Guidoacg,,,"Bidet, will benefit not just yourself but your woman or girl in relationship. 

You should also go to Walmart and buy a “Gillette hand-held shaver” it’s like $22-$25 and waterproof. 

It doesn’t give razor burn because it’s not shaving the follicle out, it’s shaving it down. 

You really shouldn’t be having ass hair in 2024’ we are much more polished as a society now and given that type of ability in technology to be able to shave without shaving cream or razor burn and being able to use it every day, is nice. 

I can attest, the hair grows back but only in 3 to 4 days will you notice it. It’s also better to shave using the electric shaver when NOT wet bc then the hair doesn’t stick to you or cause you to miss hairs. 

Back hair and ass hair should also be gone for clinical reasons. Not just odor. Skin cancers.  As someone who almost lost his mother to a Melanoma on his mothers bare skin back, you can just imagine the amount of cancers under mens skin with the hair on top of it.  The Hair does not simply protect it bc the suns rays can’t reach it. Yes, they can penetrate it.",0,1719852512,,,0,lb5fi7e,t3_1dstwy5,t3_1dstwy5,1719852528,1,False,hygiene,t5_2qkqs
Futounm,,,"Start vaping as it is less affect in health.. but bro the way I use it it’s definitely going to cause opcd or something.. I already always got sick, have GERD that I wake up every day with a pain in my chest and even though the first thing I did? Vaping!! yes I reached the dangerous point when I realised that it’s effecting my health but I continue to do it anyway. I grow up with a family that addictive to smoking .. my cousin lost his leg and got a clot in his heart artery because of smoking he is only (34) , my uncle died because diabetes and smoking both contributed to organs failure, my other uncle got stomach cancer.. they all heavy smokers that when they got sick, doctors tell them to stop but they continue anyway just like what started to happen to me.",0,1719852565,,,0,lb5fob6,t3_1ds3p5i,t1_lb50unz,1719852581,1,False,QuitVaping,t5_35pvf
OffMyRocker2016,,Stage IV NSCLC ,"Desmoid tumors are benign tumors and not cancerous, nor can they become metastatic so, no, you won't likely find any other patients with those tumor types in this sub. This sub is only for diagnosed cancer patients and their caregivers to post here. 

Although benign desmoid tumors can be treated with chemotherapy, radiation, etc, you'll probably want to continue to post in the r/desmoid sub and, if you do wind up undergoing chemo later, you can also post into the r/chemotherapy sub at that time as well, but posting here is not appropriate for your diagnosis/condition.

I wish you all the best with your diagnosis and I'm very glad you don't have cancer. Take care. 🌻",0,1719852612,,,0,lb5ftlb,t3_1dsvdm4,t3_1dsvdm4,1719852627,-1,False,cancer,t5_2qixx
Sandscarab,,,100% experienced this.  I finally went into therapy after removing all contact with my Dad 3 years ago and I was told exactly this.  My mom passed away when I was 23 (39 now) from cancer so I had for years was his abuse.  Everyone needs to go into therapy to start the healing process.  30 years of abuse will not take 1 year to go away.  I have a feeling I will stay no contact until the end.,0,1719852621,,,0,lb5fums,t3_1dstwtx,t3_1dstwtx,1719852638,1,False,TikTokCringe,t5_mvcq5
breastcancer-ModTeam,,,"This subreddit is heavily centered on patients. Patients may express fear and emotions outward to anyone. Caregivers, relatives, friends, and coworkers should only ask specific questions and express support.
Caregivers should direct their concerns to
/cancercaregivers /caregiversupport /cancerfamilysupport",0,1719852686,moderator,,0,lb5g217,t3_1dsxnw6,t3_1dsxnw6,1719852703,1,True,breastcancer,t5_2t6dy
Unlucky-Name-999,,,"Get a personal trainer because you're missing something. 


I've trained people with wasting diseases like cancer once they were medically cleared. Everyone I've ever met that says they've tried everything is missing something enormous like counting calories and macros incorrectly or not lifting properly at all.


I don't think there's anything small you're missing. You're probably missing something enormous that's right under your nose.


Even bodybuilders who get in the best condition of their lives entrust everything to a coach once they hit a critical stage and need a second set of eyes. They already known 99.9% about what to do for diet, nutrition and training but it's the second set of eyes that they're paying for.",0,1719852701,,,0,lb5g3ng,t3_1dsvlpe,t3_1dsvlpe,1719852719,2,False,Biohackers,t5_2vnoe
aenirshearth,,,"I read the book when I was in my late teens/early 20s. I can't remember if I read the book first or watched the movie. But the ending was the first to make me really angry.

<spoiler> I can't remember any of the character's names at this point, but I remember the ending. Basically, what happened was the main character was conceived as a donor for her sister, who's dying from cancer. She emancipates herself from being a donor, almost gets a happy ending, then is involved in a car crash. She dies instantly. Her lawyer decides to cut her open and give her sister what she needed to survive. In the end, the sister survives and we get a viewpoint of her afterwards.</spoiler>",0,1719852743,,,0,lb5g89w,t3_1dssu8f,t1_lb52wyi,1719852759,47,False,suggestmeabook,t5_31t41
ichwill420,,,"So minority and women's rights are CURRENTLY being attacked and democrats won't do anything now. But surely if elected again they will consider thinking about doing something. I'm sure of it. They've been saying it since the 90s and the problem is the voters aren't voting hard enough. Even when they have the presidency, senate super majority and a house majority they fail to do anything they campaign on but thats the voters fault for not voting even harder! Promise! The problem isn't the corporate capture of the DNC or the open bribes we see politicians get handed every quarter. It's the voters. Promise! Please do some research. The democrats job isn't to stand up to Republicans, they share a lot more than they pretend, their job is to stand up to progressive voters. And here we are. Yet again. With undeniable proof that this is the case. Democrats will not save this country. To quote Biden ""Nothing will fundamentally change"". He said that reffering to him taking over after trump. Biden said that nothing will be fundamentally different between a trump presidency and a Biden presidency. So on the one hand we have Biden saying his and trumps presidency will be the same and on the other democrat voters are convinced a trump presidency would be the end of the world. Kinda funny if you ask me. Imma trust the guy you swear is the answer and agree there is no fundamental difference between the two. The genocide will continue regardless. Women's rights will be attack regardless. Minority rights will be attacked regardless. The police state will continue to be amplified regardless. The meddling in foreign affairs will continue regardless. The CIAs terrorist operations will continue regardless. Etcetera Etcetera Etcetera. Read a book or three. America's problems didn't start in 2016. Trump is a symptom, not the disease. And if the disease isn't treated the symptom, unhinged populist playing on American xenophobia, racism etc, will get worse. Trump worries me less than the potential of someone younger, more charismatic and better connected to the political apparatus taking up his same platform. Remember if its not project 2025 its project 2029. There is a cancer in american society. Liberals would like to compromise with it. Weird thing about tumors though, they dont negotiate. Have a good day and stay safe out there!",1,1719852776,,,0,lb5gbyq,t3_1dsq8jp,t1_lb462a0,1719852792,-5,False,WhitePeopleTwitter,t5_35n7t
Otherwise_Tale638,,,"I don't follow much social media and I haven't watched any other people's cancer journeys (like Jace or Whitney), the only reason I even found out about E was because she popped up on my IG reels a few months ago. Have any of y'all that watch other cancer pages ever seen them doing these akward, somber interviews with various family members? She's doing them to show emotions, sometimes having the sad music in the background, but they're having the opposite effect. They come across cold, uncomfortable and very much staged/scripted. I just can't imagine anyone who's truthfully documenting their cancer journeys doing these weird, cringe inducing videos 🤨",0,1719852827,,,0,lb5ghmm,t3_1dsqoqf,t3_1dsqoqf,1719852842,7,False,ECStilsonFakingCancer,t5_azccew
VannaMalignant,,,"My cousin’s drug overdose, my mom’s cancer diagnosis, and a rough breakup.",0,1719852839,,,0,lb5giza,t3_1dseml1,t3_1dseml1,1719852855,1,False,AskReddit,t5_2qh1i
nogoodbumperstickers,,,"Support from people I didn’t expect it from, which makes me rethink how I handle things when I hear someone else is going through a difficult situation.  I’m an introvert and always figure others are surrounded by others and they don’t really know me or need me.  At this point I realize that I need to respond (card, calls, meal, drop by to help) and let them define their level of need—-I need to stop defining it by my own comfort levels. 
Weirdly, my most helpful support came from someone I barely knew personally. A teacher, who I had to inform about surgery/chemo, due to impact on classes. She was fully curious about it all, asked a million questions and gave me someone to talk to without complicating a relationship.
Unfortunately, my SO has done little more than occasionally ask if I need anything. And my brother hasn’t said/done anything. I’ve called him about other family issues and he’s never asked how I am. That hurts. 
I’m still in treatment but plan to look into some therapy to help settle all that has come unmoored by the cancer.  I don’t trust my feelings fully right now—body and brain full of foreign and toxic things, but I know I need to find a calmer focus and kinder path on the way out of this crazy.",0,1719852868,,,0,lb5gmcq,t3_1dsqlkf,t3_1dsqlkf,1719852885,4,False,breastcancer,t5_2t6dy
Round-Ad6943,,,Last week was very difficult for me mentally and this post made me feel validated. My mom passed away in January from cancer and my dad was just diagnosed with cancer and it all kind of hit me at once. This week will be better!,0,1719852913,,,0,lb5gras,t3_1dsh68x,t1_lb4mnfu,1719852929,3,False,orangetheory,t5_39w4v
woeful_bby29,,cancer stellium,"I’m not a Cancer Venus but I do have the same issue with trying to reach out to strengthen a connection but then being too intense too fast. Could partially be my Scorpio moon, but I’ve really had to learn to withdraw my energy and be slow with love and bonding, let people come to me, and make efforts of connection when it feels right in my soul, and not because I think I’m going to secure a mate/friendship this way. 

Hopefully one day I can have a more assertive approach to relationships but for now it’s fine to nurture oneself and take time.",0,1719853025,,,0,lb5h3w5,t3_1dswhxo,t3_1dswhxo,1719853042,6,False,CancertheCrab,t5_8h84w9
