author,author_flair_css_class,author_flair_text,body,controversiality,created_utc,distinguished,edited,gilded,id,link_id,parent_id,retrieved_on,score,stickied,subreddit,subreddit_id
moonmanmonkeymonk,,,"I’m a fairly recent convert — grew up in a “meat and potatoes” family. Occasionally my mom would put down a salad or boil some brussels sprouts. We mostly ignored it.  

Two years ago I discovered that the meat I was eating was the primary cause of my kidney disease — the disease that killed my mother. I switched to being vegan overnight. In the past two years I’ve only eaten one hamburger, one piece of fish, and one order of chicken strips (Complicated reasons. I regretted every time. It won’t happen again.) No eggs, no dairy, etc. 

The hardest part was cooking food for my kids, knowing I was feeding them the same poisons that caused all my health problem and killed their grandparents. But they’re young. They have time… 

Here’s the thing — Foods can be just as addicting as drugs. In fact, it’s a somewhat blurry line between food and drugs. Grapefruit is known to have dangerous interactions with a lot of drugs. Interactions between aflatoxin (from moldy peanuts, in amounts smaller than anyone can taste) and casein (the protein in dairy) is known to cause liver cancer — 100% of the time in high enough doses (still lower than you can taste. ref: *The China Study*, T. Colin Campbell). 

This is controversial, but I believe it will be proven eventually. Meat is addicting, just like alcohol and other drugs. Meat is more than just protein. It is saturated with hormones and fatty acids that affect the gut microbiome and allow those hormones to pass through the gut, directly into your blood stream, where they do what hormones do in your body. Other mammal's hormones are all similar enough to human hormones that your body is somewhat confused about how to react to them, causing problems. This study needs to be done! 

If you listen carefully to meat eaters make their excuses, they’ll sound familiar to anyone who’s had experience with any other kind of addict. I think we’d make better progress if we start treating the overconsumption or meat like an addiction. 

While I’m 100% whole-food vegan myself, the evidence is clear that consuming 5% to 8% of your total calories from meat (preferably fish) is not necessarily bad for most people. Meanwhile, our meat and dairy production is still devastating for the biodiversity of the planet, for the climate, and is morally *evil* (I was going to say reprehensible, but the more you know….) 

We need to treat meat like an addiction — if you ate chocolate cake, cherry pie, and tiramisu at every meal, no one would dispute that’s too much. Those are treats, not staples. If you drank beer and wine and whiskey at every meal no one would dispute that you have a problem. Meat is the same. We’ve been oversold on the importance of protein. Meat protein is no better for you than plant protein, and if you’re getting enough calories, you’re getting enough protein, no matter what its source. Meanwhile, the importance of fiber is tremendously under-acknowledged, and animal products have *zero* fiber.)  

Meat is a treat. It is a supplement to an otherwise perfectly adequate diet, and like sweets and alcohol and salty processed foods, it is addicting.  In the history of human evolution, it has always been that way. It needs to be that way again. We’ve grown to expect a too-rich diet, and our planet cannot provide it for the number of people who are demanding it.",1,1719842085,,,0,lb4kulo,t3_1dsrdkr,t3_1dsrdkr,1719842101,6,False,environment,t5_2qh1n
moonmanmonkeymonk,,,"I’m a fairly recent convert — grew up in a “meat and potatoes” family. Occasionally my mom would put down a salad or boil some brussels sprouts. We mostly ignored it.

Two years ago I discovered that the meat I was eating was the primary cause of my kidney disease — the disease that killed my mother. I switched to being vegan overnight. In the past two years I’ve only eaten one hamburger, one piece of fish, and one order of chicken strips (Complicated reasons. I regretted every time. It won’t happen again.) No eggs, no dairy, etc.

The hardest part was cooking food for my kids, knowing I was feeding them the same poisons that caused all my health problem and killed their grandparents. But they’re young. They have time…

Here’s the thing — Foods can be just as addicting as drugs. In fact, it’s a somewhat blurry line between food and drugs. Grapefruit is known to have dangerous interactions with a lot of drugs. Interactions between aflatoxin (from moldy peanuts, in amounts smaller than anyone can taste) and casein (the protein in dairy) is known to cause liver cancer — 100% of the time in high enough doses (still lower than you can taste. ref: *The China Study*, T. Colin Campbell).

This is controversial, but I believe it will be proven eventually. Meat is addicting, just like alcohol and other drugs. Meat is more than just protein. It is saturated with hormones and fatty acids that affect the gut microbiome and allow those hormones to pass through the gut, directly into your blood stream, where they do what hormones do in your body. Other mammal's hormones are all similar enough to human hormones that your body is somewhat confused about how to react to them, causing problems. This study needs to be done!

If you listen carefully to meat eaters make their excuses, they’ll sound familiar to anyone who’s had experience with any other kind of addict. I think we’d make better progress if we start treating the overconsumption or meat like an addiction.

While I’m 100% whole-food vegan myself, the evidence is clear that consuming 5% to 8% of your total calories from meat (preferably fish) is not necessarily bad for most people. Meanwhile, our meat and dairy production is still devastating for the biodiversity of the planet, for the climate, and is morally *evil* (I was going to say reprehensible, but the more you know….)

We need to treat meat like an addiction — if you ate chocolate cake, cherry pie, and tiramisu at every meal, no one would dispute that’s too much. Those are treats, not staples. If you drank beer and wine and whiskey at every meal no one would dispute that you have a problem. Meat is the same. We’ve been oversold on the importance of protein. Meat protein is no better for you than plant protein, and if you’re getting enough calories, you’re getting enough protein, no matter what its source. Meanwhile, the importance of fiber is tremendously under-acknowledged, and animal products have *zero* fiber.)

Meat is a treat. It is a supplement to an otherwise perfectly adequate diet, and like sweets and alcohol and salty processed foods, it is addicting.  In the history of human evolution, it has always been that way. It needs to be that way again. We’ve grown to expect a too-rich diet, and our planet cannot provide it for the number of people who are demanding it.",0,1719842107,,,0,lb4kwri,t3_1dsrdkr,t3_1dsrdkr,1719842123,1,False,environment,t5_2qh1n
Joy_3788,,,"“Thou human souls worry too much about death, so what your child has cancer? The father has a plan for all and some have to go early.”",0,1719842165,,,0,lb4l2eg,t3_1dslalk,t3_1dslalk,1719842180,1,False,HazbinHotelOCArt,t5_2ofbld
muddyshoes_throwaway,,,"""using it EVERY SINGLE DAY THAT YOU CANT FUNCTION WITHOUT = ADDICT.""

I disagree. Consider this: weed is used medically to treat things like anxiety, depression, EDs, chronic pain, nausea, etc. Lots of people try various different medications before they find one that works for them, with side effects that they can live with. Most people, when they find a medication that works for them, continue taking it. They treat their medical issues with the medication that works.

If someone has really bad depression and they find an antidepressant that works well for them, why would you expect them to stop treating their depression with it? 

If a cancer patient finds a medicine that helps with chronic pain and nausea, and helps them maintain an appetite, why would you expect them to stop treating their symptoms with it? 

If someone finds a medication that works for them, they should be able to use their medications to treat their illnesses and symptoms without being judged for it.

Personally, I consume cannabis in some form, every single day. I treat my severe anxiety with it. I had been on a handful of other prescribed medications for it, and they either didn't work, or had horrible side effects. 

Would you rather I use Xanax everyday and develop a xanax addiction? Because I would rather use weed, which has minimal side effects, is less chemically and physically addictive, is easier to monitor intake, and can be tailored to what I need in the moment.  

Some people forget that weed is literally used to medically treat TONS of different illnesses and symptoms. I think it's ignorant to think less of people who finds a medication that works well for them, and judging them/thinking less of them for taking it. 

Butt out. It's not your business. And try not to be so ignorant of marijuana.",0,1719842195,,,0,lb4l57z,t3_1ds0p6w,t3_1ds0p6w,1719842211,1,False,AmItheAsshole,t5_2xhvq
speakbela,,Stage II,"I had 8 chemos, 4 AC and 4 double dose T. My veins collapsed after the 3rd chemo and for some reason my doctor said I still didn’t need a port. We were young (into our cancer journey—my husband was and is my healthcare proxy) and while we did complain for some reason it fell on deaf ears.  After chemo I had a right breast mastectomy with 13 lymph nodes taken in addition to the whole axillary dissection. So! Now I can’t have any needles or BP taken on my right, and I have lymphedema now! Ugh.  So all this to say, if I had a port, maybe my veins wouldn’t have collapsed and maybe my chemos would’ve been a bit easier as opposed to the nightmare of having 17 different nurses trying to start a line every time with my paper thin veins. I used to be a great stick too. Now I have the worst needle anxiety because most of the time people can’t access the veins on my left side unless they are really really good with cancer patients or little kids.  If I need bloodwork done for anything now I call my sister and bff who are both nurse managers (different fields, MS and surgical ICU) because they themselves hired their team so I get their top notch phlebotomist, and because all my doctors are in the same network (Hackensack) they all have access to the portal.    I’m 40 and this is what I have to do with every doctor who wants blood.  We learned our lesson and now my husband and I are the very eloquent squeaky wheels, ask, request and then demand.  Get the port.",0,1719842214,,,0,lb4l6yr,t3_1dsgqvu,t3_1dsgqvu,1719842229,2,False,breastcancer,t5_2t6dy
Louloubelle0312,,,"I'm laughing at your ""anywhere between today and a month from now"", because I took in a stray about 17 years ago, and decided to keep her. I took her to the vet, who told me she was pregnant. I asked about a termination, but the vet said she was actually due any minute. Huh, I thought, I've had cats for decades, and didn't recognize that. But, ok, we'll find homes for the kittens. It was nearly another month before she had them. She was lovely girl, but died from cancer at only 9 years old. Her daughters (yes, I kept two of them) still live with me and my family. One is sweet but is developing a bit of dementia. The other (a calico, of course) is the spawn of the devil and is destined to live forever.😊",0,1719842259,,,0,lb4lb9z,t3_1dsrfa0,t1_lb480qj,1719842277,345,False,cats,t5_2qhta
Fayowyn,,,"Women are encouraged to breastfeed because of it's many benefits. It should be encouraged to relieve pressure on the NHS, to help the childhood obesity crisis and to prevent cancers. 

In this thread I have come across the perfect advice for this situation. They may not have a GCSE in it but my god, these women know what they are taking about. I worked as a peer supporter (so am I qualified?) and the advice given in this thread is genuine and evidence based, along with a healthy dose of experience. This is what mothers are missing in our society, people who know and understand the mechanisms of breastfeeding to support and advise others. If you have no idea of the way breastfeeding works (because it is so completely different to formula feeding), then stay out of a thread where someone is asking for breastfeeding advice. 

And yes, the majority of women do give up breastfeeding in the UK. But do you know what? A lot of those women also say they gave up BEFORE they WANTED to. Because of people who don't understand breastfeeding not answering their calls for advice and support and instead pushing formula as if it's some miracle panacea.",0,1719842301,,,0,lb4lf7z,t3_1dslhle,t1_lb4jivr,1719842317,3,False,UKParenting,t5_iygqf
Delicious_Piccolo955,,,"They could be talking about anything, as far as her saying maybe I will get better ( could be anything) mom says I think you will get better ( could be anything) we really have no idea what they are talking about could be just pain that she’s talking to her mom about and to her online community they may think she’s talking about cancer where mom thinks she talking about pain. Notice her other account (Elisa Beth Magagna ) she’s only adding certain videos",0,1719842379,,,0,lb4lmo1,t3_1dsrrsj,t3_1dsrrsj,1719842393,13,False,ECStilsonFakingCancer,t5_azccew
NoLengthiness5509,,,"My sincere condolences to you. Losing a mom when the relationship was so good is never easy. Don’t feel like a toddler for feeling how you’re feeling. That is normal. 

My mom had a really long fight with this disease. She passed recently as well. I am not crumbling bc I had so much time (the different bouts of cancer, with almost 10 years of remission). You didn’t, it was too little time; to process her disease and suddenly she’s gone. 

To cope: 1. give yourself grace, you’re allowed to be as sad as you need to be. But in due time, try to remember that the grief is love. Just another side of love. 2. Also later, lean into whatever happy memories you shared with her. 

Sending you strength and light.",0,1719842419,,,0,lb4lqi6,t3_1dsmgr1,t3_1dsmgr1,1719842436,3,False,CancerCaregivers,t5_37mbk
NatPortmanTaintStank,,,"Living without your child/children/grandchildren

Could you imagine tragically losing your only child along with your grandchildren in a car accident or something and then slogging on for the rest of your life?

Your wife/husband has already been taken by cancer, and you lost your parents when you were 15.

No siblings because your brother died of heart disease before the age of 55, leaving you as a happily married 30 something with a partner, daughter, and grandchildren.",0,1719842539,,,0,lb4m22u,t3_1dsoaal,t3_1dsoaal,1719842560,1,False,AskReddit,t5_2qh1i
Holiday_Shelter3635,,,"Thanks for all of the advice, this board never disappoints.

Here are answers to a couple of the questions that consistently came up in responses:

1.) I’m making $250K per year right now, and have averaged about $190K per year over my 25 year career when you factor in the early years where I was making about $150K.

2.) I grew up very poor, so I’ve had to shoulder the entire load myself, no inheritance, trust funds, etc.

3.) Though I’m in great health at 49, both of my parents died from cancer in their late 60’s. I’d like to think that I’ve lived a healthier life than them, but genetics is always in the back of my mind.

4.) I am a sole income earner for a household of 5 (my wife and I, two 18yo’s, one 14yo). It’s all been on my shoulders the whole way with no safety net.

5.) We just paid off our house, and have no other debt of any kind, and my property taxes ($3500) + home insurance ($870) + HOA ($1300) is roughly $500 per month.

6.) Regarding taking SS at 62 (like a fool as one responder said) versus waiting until max benefit at 70, it’s a bet on outliving your break even point. If I won’t really need that SS money then I can just save it as well and add it to the compounding wood pile for 8 years instead of sitting on zero and waiting for a higher rate at 70.
 
I was surprised that one response thought we’d have more savings than $1.6M at this stage. For a single income averaging ($190K per year to this point) to be mortgage free on a $1M house + $1.6M in savings supporting a family of 5 in AZ and FL (the two fairly HCOL areas we’ve spent the most time in) has been an exercise of great discipline and restraint.

Moving forward from here, my goal is to save $80K per year for the next 5+ years, let compounding do its thing for the money already saved (hopefully), and consider retiring at 55 makes sense.

Lastly, I’m very blessed and appreciative to have the job and income that I do, but a lot of stress and anxiety comes with my role, thus I don’t particularly want to do it longer than I have to. Plus, I’ve never really enjoyed myself along the way, I’ve just put my head down and worked hard my whole life…I want to start enjoying life a little more, and the things I enjoy most (my wife, hiking, biking, fishing) are all free.

If I can make it to 55 as a mostly empty nester (my 14yo will be 19 at that point), be mortgage free in a beautiful house that I love, have $2.5M saved at that point with an overall NW of roughly $3.7M, have SS supplementation just around the corner at 62, then what’s the point of working any more? So that I can deny myself even longer in the name of leaving more for the kids? They’ll each graduate college with a clean slate financially, and get $1M+ when my wife and I die (which is $1M+ more than I got) so I think my job will be well done at that point and I can finally sit down and exhale.

I just feel like I hear more people in my situation say that their money is going longer in retirement than they thought, and wish that they’d have retired earlier so that they could enjoy those early retirement years of 55-70 before their health gave way.

Thanks for all of the responses.",0,1719842608,,,0,lb4m8hp,t3_1dsilks,t3_1dsilks,1719842624,2,False,ChubbyFIRE,t5_wuxe9
Brett_ta_ta,,,"He’s a urologist and I assume he’d be pretty versed in it already. I had kidney cancer 4 years ago and he saved my life so I trust him a bit, but I just thought the dose might be too infrequent. Bi-weekly with test cyp seems infrequent but I wasn’t sure if maybe my insurance would only allow a small treatment to begin and then move up as needed. My insurance is partially funded through my employer so it’s pretty terrible and hoops have to be jumped through most days for anything good to occur.",0,1719842681,,,0,lb4mfg9,t3_1dssqym,t1_lb4hiii,1719842698,1,False,trt,t5_2qius
Chrowaway6969,,,"I don’t understand why people continue to even speak to family like this. It’s not a life sentence of forced contact because you’re related.

Cut out the human cancer.",0,1719842682,,,0,lb4mfju,t3_1dssbby,t3_1dssbby,1719842698,27,False,BoomersBeingFools,t5_22p3je
Artistic_Purpose1225,,,"My parents are both call and texters, but there was a while back where every time I got an unexpected call from them it literally was because an family member died or was dying. I lost 9 family members, had one survive a major stroke, one in a car accident, one’s dementia got bad enough to be permanently in hospital, and three cancer diagnoses(one of which was my very young niece, who is now close to hitting the five year cancer free mark!!) in a period of 4 months. 

That was nearly seven years ago, and I only *just* stopped bracing myself whenever they call unexpectedly. ",0,1719842711,,,0,lb4mici,t3_1dsluqm,t1_lb40gs5,1719842725,9,False,comics,t5_2qh0s
NakeyDooCrew,Cavan,Cavan,"My uncle had cancer. It showed up on tests for something else and they spotted it but it took them TWO YEARS to contact him, by which time it was stage four. He's since passed away. He was a wonderful man who spent his whole life helping people.

From GP care to hospitals our health service was better in the 1980s.",0,1719842725,,,0,lb4mjp0,t3_1dsrlxk,t3_1dsrlxk,1719842742,40,False,ireland,t5_2qhb9
Nala_Namaste,,:Cure:,"i also had a family member pass from breast cancer, an aunt of mine, and i wanted so badly to get both skins for the cause, but i could only afford rose gold, so I'd love to have pink :) you're a sweetheart, i love where ur heart is at <33",0,1719842890,,,0,lb4mzlw,t3_1drvmzz,t3_1drvmzz,1719842907,2,False,MercyMains,t5_3e8bz
wearenotflies,,,"1. Nephrologist specializes in kidneys specifically they know more than urology. Might need to work with oncology too. 

2. You probably aren’t going to find something right now on it because the jabs are new and this weird shit is popping up. I am in the hospital now watching my sister die from turbo cancer and multiple nurses and doctors have expressed their concerns on the covid jabs and cancers and tumors. 

But you will just say where’s the studies. There will be one day just sit back and wait, it takes time for this stuff to come to light, it isn’t as quick as our immediate gratification brains are now.",0,1719842920,,,0,lb4n2gm,t3_1dsc82v,t1_lb3qty8,1719842936,3,False,unvaccinated,t5_4c46db
Remarkable-Stop2441,,,"Getting this ugly cancer diagnosis has made me care less about unimportant things. Regardless of the stage, grade, size etc. being told I have cancer was life changing and scary for not just me but the people who love and care about me too. 
I’m surrounded by family and friends and coworkers who’ve shown me nothing but love and support.
My husband and young adult kids are awesome. My sister and 4 brothers who live in Ireland are incredible, they’re all coming to visit me at the end of October so we can all just be together. My group of close girlfriends  are in it with me for the long haul. My heart is honestly full of love at such a rotten time.",0,1719842938,,,0,lb4n484,t3_1dsqlkf,t3_1dsqlkf,1719842952,4,False,breastcancer,t5_2t6dy
Practical_Tear_1012,,“Side-Eye Sophie 👀”,They going after his mom?! Guess I'm not surprised though they attack a woman with cancer regularly. No morals what so ever,0,1719842990,,,0,lb4n99u,t3_1dsslbd,t1_lb4kgfu,1719843005,41,False,SaintMeghanMarkle,t5_481xkf
Cadyserasaurus,,,"In my general experience, these women think they will be the exception to the rule. They identify more with being white than they do with being women. They’ve been raised to believe that if they do everything they’re told: get married young, start popping out kids, etc. then they will be highly valued and therefore safe. 

They think that abortion and birth control laws are for promiscuous women; but as soon as the fetal test comes back with a fatal abnormality, they want that abortion and are shocked that it isn’t an option. They think women are more valuable & fulfilled as stay at home moms & tradwives; which is why they never see it coming when their husbands leave them at 40 for a woman 20 years younger. They think their husbands care for and value and love them; until they get breast cancer and find out their husbands would rather divorce them than give even an ounce of that caring back. They KNOW the ideology of conservatism views them as little more than property; and then they’re confused when they get objectified, abused, cheated on, etc. 

This woman explains it pretty well imo: https://www.tiktok.com/t/ZTN6rfSQF/

This is why the majority of suburban middle aged white women had absolutely no problem voting for Trump or Republicans in general. Because they truly believe, when the time comes, an exception will be made for them. 🙃🙂",0,1719843037,,,0,lb4ndwq,t3_1dsrxqw,t1_lb4hwav,1719843053,79,False,chappellroan,t5_6d35ad
idungonwent,,,"You would think, but I know people who have done exactly that. One guy claimed he stopped the chemo because it wasn't working and just ate spicy peppers to kill the cancer naturally. In reality he finished several rounds of chemo and just stopped following up with doctors. He died when the cancer eventually came back. I also know people who are mourning dead friends/family and screaming that it was the chemo that killed them. Not thinking about the fact that their anti-preventative medicine stance meant that they didn't seek treatment until it was too late. Bit of a self fulfilling prophecy.",0,1719843126,,,0,lb4nmqs,t3_1dsicld,t1_lb4g7j7,1719843141,8,False,facepalm,t5_2r5rp
