author,author_flair_css_class,author_flair_text,body,controversiality,created_utc,distinguished,edited,gilded,id,link_id,parent_id,retrieved_on,score,stickied,subreddit,subreddit_id
Spare-Patience-6195,,,"Oh wow! You might be right. I didn’t think about her not resigning. I just thought about how she went to Harvard Law School when women were expected to stay home and raise a family. She did both. She took care of her husband when he got cancer, even took his class notes for him while he was sick. She fought for equal for everyone that just wasn’t heard of at the time. That’s all I was thinking.",0,1719792014,,,0,lb1ylx2,t3_1dsbt6r,t1_lb1uv92,1719792031,2,False,AskReddit,t5_2qh1i
Street_Hedgehog_9595,cath,Catholic,"To win, you need to make it your number one goal to put God first. I might sound harsh, but you need to be actually serious about this. If this were some competition to win 1,000,000 dollars if you didn't have sex again before marriage, do you think you'd do better? If yes, then you have a lot of work to do. And take it seriously, not ""oh yes! I will do this.. tomorrow!"" 

Here are at least key things I think of.  

1.	⁠⁠⁠⁠⁠⁠⁠⁠⁠You need complete full determination. One must do a great deal of effort (big extremes is what I'm getting at) to himself to stop sin. It is like a cancer. You do not treat a cancer with a nap and cough syrup. With deadly diseases, powerful remedies are necessary.  Do your maximum in every way, and treat it like the most important thing, embracing great sacrifice. Hence, you must hate the sin truly, fully, and fully entirely.



2.	⁠⁠⁠⁠⁠⁠⁠⁠Make a new prayer life. Give thanks to God always, and turn always. Give Him thanks in the morning, and praise Him in the day. Speak and seek Him constantly. Without constant prayer, I cannot imagine any great chance of success. From St. Alphonsus: ""St. Paul tells us, that we have to contend not with men like ourselves.... but with the princes of hell.... By these words he wishes to admonish us that we have not strength to resist the powers of hell, and that, to resist them, the divine aid is absolutely necessary: without it, we shall be always defeated; but, with the assistance of God’s grace, we shall, according to the same apostle, be able to do all things and shall conquer all enemies. “I can do all things in him who strengtheneth me.” (Phil. iv. 13.) But this assistance God gives only to those who pray for it. “Ask, and it shall be given you; seek, and you shall find.” (Matt. vii. 7.) They who neglect to ask, do not receive. Let us, then, be careful not to trust in our resolutions: if we place our confidence in them, we shall be lost. ""

Have you heard of the Rosary? It is an incredible prayer that helps us grow in worship of God, I cannot recommend it enough and I would love to help you with it if you haven't! 

Practically, fasting and exercise are very helpful I've heard.


As a Catholic, I really recommend that if you want personalized help, talk to a Catholic priest",0,1719792034,,,0,lb1ynpf,t3_1dseiwd,t3_1dseiwd,1719792049,1,False,Christianity,t5_2qh6c
got_knee_gas_enit,,,"Thanks so much.... that's kind.  Sometimes you just have to believe in prayer.  My sister's cancer that was in remission for 25 years came back, and my first grandson was just born early and weighs 2.5 lbs.  The power of prayer will help everyone.",0,1719792065,,,0,lb1yqef,t3_1ds9oid,t1_lb1xqzb,1719792081,3,False,VaxRecoveryGroup,t5_6htcnz
Spiritual-Freedom-71,,,"Thank you so much for your comment and support!! I think as they were never suspecting cancer and they never looked into it, I’m guessing that is why they didn’t find much on the scans. My gyno said i could have been fine when I had my last ultrasound (October 2023) and since they thought endometriosis was my issue, they didn’t bother with anymore scans before my surgery. At the moment they are guessing stage 1 or 2, but won’t get pathology back for a little while. Wishing you all the best!’ xx",0,1719792153,,,0,lb1yxvo,t3_1ds0a0h,t1_lb11h71,1719792170,1,False,endometrialcancer,t5_6z1tmw
Infamous-Area-2964,,DMs open,hang yourself n1gger 😛 if that's not working then drive off from bridge 😇 tehee~ 😝 you're literally the cancer of all worlds 😆 bet you would never have a loving family because you couldn't stop sexualizing your female child if you ever have one 👪 1200 years ago guill0tines served a better purpose 😍,0,1719792175,,,0,lb1yzsy,t3_1dsexxj,t3_1dsexxj,1719792189,1,False,JerkOffToAnime,t5_423j4p
Stock_Reception_5290,,,"trams must by demand in cape town south africa our trams back it was very mean spight full to remove them all they could of done up grade trams in cape town south africa buses we have now has given us health problem this what buses give us c02 dangerus gases that worse smoking it gives u lumg cancer an it very dangerus for old age people as well who cant get off the bus where the tram is easy to get on off an its friendly health wise south afica must come right for achange why dont they get rid of all buses that runs on petral diesel that causes much harm than tram ,i hate strong smell comong from cars buses we use cars buses every day nsw australia melborn use trams even up to day 2024 they say pepole health means more to them every thing trams i was there year 1971 me an my mom an dad lived in sydnie an it fun ridding on the tram we wait at the tram bus stop thetram stop right at ur stop u want to ride with the tram to the city u buy ur ticket on the tram u dont have to worry  i love the tram  in cape town one stage year 1969 we board the tram from wood stock to cape town it stops right cloes to ur place where u want to get off u fuss the them trolly bus was nice as well the double decker  the tram an the trolliy buses was the top busus no fus it very nice i love the sound of the tram metal wheels u can hear the tram passing by cape town bring back the trams best that it be 2024 best cheaper no c02 petrol clean fresh air not c92",0,1719792185,,,0,lb1z0o8,t3_1bj0a28,t3_1bj0a28,1719792201,1,False,MelbourneTrains,t5_wu3uq
Koppite93,,,I was so fucking relieved that Computer was just referring to Unc not talking to Bear about money... I was getting cancer confessions scares for a moment 😕,0,1719792186,,,0,lb1z0ta,t3_1dpeqdk,t1_lahf4ge,1719792204,9,False,TheBear,t5_6abpyt
YtterbiusAntimony,,,"Uncertainty is scary. Look at conspiracy theories: what's more likely? A secret evil cabal is plotting against us all, or our government and corporations are run by people just as clueless as you and I, who don't care about you at all?


And yet, people still chose the former, because at least it's orderly. There is a purpose behind their nefarious scheming, no matter how absurd the scheme.


It's far scarier to knowing there is lead in your kid's toys, not because those in control hate you and want to poison you, but because they don't care, and likely didn't even know.


Faith and religion are no different. I think a lot of people would rather struggle with the dilemma of why a loving god would give their mom cancer, than face the awful truth: There is no reason why. The right genes, in the right environment, and some cells started growing too fast. It wasn't intentional, it served no purpose, it was never part of a plan. It's just a weird thing biology does sometimes.


The uncertainty and indifference of the universe can be scary, but I find it freeing. If there is no meaning or purpose to life, then we're free to invent our own.",0,1719792219,,,0,lb1z3kh,t3_1dsbfnn,t3_1dsbfnn,1719792234,1,False,atheism,t5_2qh2p
AbjectAcanthisitta89,,,"Tomorrow, Steve's cancer going to be in remission. Move on brother.",0,1719792341,,,0,lb1zegn,t3_1dqca3w,t3_1dqca3w,1719792357,1,False,AITAH,t5_446kys
twigg2,,,"I work at a tanning salon and have been a member as well for years. Definitely depends on genetics, if you have skin sensitivity or family history of skin cancer or other skin conditions it can influence your likeliness, obviously. But that being said, using quality products that are sold at the salons is going to help so so much with any aging or skin damage potential. Do not get tanning products from like Walmart or Amazon or anything because you need a certain certification to carry quality products that will decrease your chances of skin conditions or damage and brands like Target, Walmart, etc do not have that certification so the brands they are selling are probably not 100% real! Also don't over do it. Don't force yourself to tan for a longer time than your body can actually handle. I always say don't go up in time in a bed until you don't get any pink or red undertones! 
Another important key is it depends on what bed you use. Most tanning salons have different bed levels and the lowest bed is the cheapest for a reason. It's a lower pressure bed but usually is super high in UVA rays which are the rays that burn you. If you can at least do a step up from this bed your chances of aging and skin damage will be lower because there will be a balance of UVA and UVB (UVB are bronzing rays so gives you the color you're looking for without a high likeliness of burning)! Also the higher pressure the bed, the less maintenance to keep the tan so you don't need to go in every single day!

Finally, I also recommend an extender lotion. This is a lotion you will replace with Aveeno or Bath and Body Works lotions and it helps extend the length of your tan. A really good one is Hemps Australian Gold because it has Derma Dark in it, which helps develop a tan and adds color! Apply these after showering or at the end/beginning of the day! Products like this will help you reduce maintenance as well!",0,1719792429,,,0,lb1zm59,t3_1ds6dds,t3_1ds6dds,1719792445,3,False,tanning,t5_2txyd
relevantusername2020,,,"well yeah. thats why i mentioned ""physical, mental, and financial well being""

you can be wealthy and be stressed as fuck. its just a different kind of stress, that personally i have very little sympathy for, but i do understand it. thats why theres a difference between empathy - meaning, basically, putting yourself in anothers shoes - and sympathy, which is basically pitying someone for their situation.

the cancer of capitalism effects us all, when youre poor you just dont have much of anything besides the drugs, when youre wealthy you have the drugs and money. theres a lot of people with basically no social support to speak of, whether thats friends or family. it just looks a little different, but its really not all that different... except the stress of not being able to eat, or go to work, or afford a house is a lot more severe than the stress of having to ""keep up with the joneses"" or whatever.

its complicated.",1,1719792479,,,0,lb1zqqc,t3_1dsdhds,t1_lb1z6mf,1719792494,0,False,todayilearned,t5_2qqjc
CharminggCharm,,,"My Father was diagnosed with an advance stage of a rare cancer, he fought for over a year with traditional chemo and radiation. In early 1999(ish) a radical and trial surgery became available for him in Philadelphia.

The whole family left on a road trip to the hospital where the surgery was scheduled for, about half way to Philly, we stopped for lunch. At the end of our meal, he announce to us that he decided to not go, and to return home. He said ""I want to have fewer good days with you, rather than more bad days."" We then turned around and went home.

I will never forget that day.",0,1719792481,,,0,lb1zqu2,t3_1dseml1,t3_1dseml1,1719792497,162,False,AskReddit,t5_2qh1i
youareagoldfish,,,"Some folks crave a fight. Once they have the craving they need to hook a sacrifice. It can be hard to notice the bait in the moment, but it's usually weird behaviour. So in this case, rinsing a glass with boiling water. My pwbpd likes to pull weeds in the middle of day in the sun without any sunscreen or ppe. And then, when someone goes out to point out to them they're playing with skin cancer, they get to have a whole little meltdown about how they HAVE to do this no one HELPS them yadda yadda yadda. Ignoring them delays the fight, but if they're seeking it, they'll come to you. Best thing to do is leave. Physical distance and turn off the phone. They'll crack and try to sacrifice the next person on their list instead.",0,1719792545,,,0,lb1zwhc,t3_1ds8aky,t3_1ds8aky,1719792561,6,False,raisedbyborderlines,t5_33d8b
Breathing_inandout,,,"That study is 6 years old which makes it ""pretty old"" in the medical world, especially when light years of LDN experience has occurred since the pandemic began and its use with Long Covid.



There is SO much medical information out there that never makes it to publication ( which takes years) that doctors share among themselves, especially at academic institutions. So, in Northern CA, Stanford, UCDavis and UCSF specialists are constantly in touch with each other with regard to patient experience.



Unfortunately, this means that  the doctors who have no  interaction with academic physicians get left behind and why CME (continuing medical education).



There are many medical issues that become ""common knowledge"" to doctors, but they forget to share that information with their patients ( and with local community doctors who are always welcome to attend conferences at these medical campuses, but never have time).



And the most important data of all is actual patient experience. An issue is only rare until more data is collected and people report it.  With time, ( often too late and in retrospect), something rare becomes common.



Drug safety always refers to side effects first and foremost.



Drug interactions are much lower down the list  and ends up being a rapid fire sentence at the end of those drug commercials.



As far as drugs go, LDN is a safe drug, safer than any drug I know and that includes many vitamins, herbals and over the counter medications.  It's so safe that the UCD primary care doctors strongly encourage their patients to try it! And many LDN prescribers take it themselves to delay inflammaging which delays malignancy as well.



LDN is a drug that helps your body make more of your OWN endorphins.  The only drawback is the liver issue which excludes alcoholics and liver failure patients. Opioid addicts were excluded until recently when ULTRA low dose Naltrexone was compounded and has become a HUGE fighting tool in the Opioid Crisis.



As for the patient with inherited fast acting liver enzymes, her LDN prescription was changed to sublingual because that route completely bypasses the liver and goes directly into the blood vessels under the tongue directly to the brain to pump out more endorphins.  The LDN tablets she was taking  were flying in and out of her body, not giving her enough time to go through the process and kick out more endorphins.



As far as starting many NEW drugs at the same time, that's not a good idea.  Of course, in some situations like medical emergencies and cancer treatment require a blast of drugs.



However, if a patient develops side effects, the clinician will NOT know which drug was responsible and it ends being a process of elimination.



And yes, many patients who start LDN are on other drugs, especially those with multiple autoimmune disorders. If you read the newly released LDN book ""New Horizons"", you will see many patients who were able to stop most if not all those other drugs as they reached their LDN maintenance dose.  My own medical cabinet is quite empty now! 



I hope this helps.



There is a reason why medical school and  residency programs take years and years and it's still NOT enough. Doctors are constantly trying to keep up. So, it's helpful when a patient can bring in information like the 2024 LDN guidelines from the LDN research trust website.



I think your questions are excellent and would be appreciated at the LDN RT Webinars.  Whatever questions are not answered during the webinar are answered on the LDNRT You Tube site,



The next LDNRT webinar ( July 9)  will have an excellent speaker ( pharmacologist Dr. Sam Lebsock)  who can address your questions. The entire webinar is Q&A on LDN!",0,1719792579,,,0,lb1zzdq,t3_1dmlqsl,t1_lb1zttb,1719792593,1,False,LowDoseNaltrexone,t5_3awid
weemosspiglet,,,"I feel for you! You’ve done so much work and overcome so much abuse and now here you are in a really difficult moment.  What you said about being repulsed by your mom’s vulnerability really resonates with me-we get fooled so many times by the waif/witch switch!

I cared for my uBPD mom through a long and self-caused and ridiculous life threatening illness that she miraculously survived despite her similar efforts at sabotage and waifing.

I ALSO cared for someone (my dad) I loved very much in the final stages of his cancer and what stays with me about both experiences is that, well, dying is NOT easy even if you’re kind and emotionally sound.

It makes sense that your mom is making illness and dying extra hard.  Of course you don’t want her in pain, or sicker than she needs to be, or dead when you find her. It is so maddening to think that if she reframed her thoughts or listened better this cancer diagnosis wouldn’t have worsened. But all those things could happen even if she was a standard issue parent because end of life stuff is incredibly charged and messy regardless.  At this moment, there are so so many caregivers watching their loved ones or their abusers die and wondering how they got to this place and why there’s no guidebook. You’re not alone 💜",0,1719792720,,,0,lb20bh9,t3_1dseqmg,t3_1dseqmg,1719792736,3,False,raisedbyborderlines,t5_33d8b
Casual_Niz,,,"A fine answer for a proper tournament, but at locals where there's no big events that people are practicing for, hell no.

If you're gonna be a dick by bringing an absolutely cancerous deck to locals, an environment meant for having fun and making friends, and stunlock me with some bullshit, I don't have to be nice to you. Take that crap to Regionals where winning actually means something or Master Duel where you can hide behind a computer and not deal with how annoyed I am by your aids stun deck.

You chose to turn up with something awful to play against when you could have played something more fun and interactive for the both of us, that could still have been a good deck. I don't owe you niceties for that.",0,1719792807,,,0,lb20iyv,t3_1dsbfnq,t1_lb1tsus,1719792822,9,False,yugioh,t5_2rpe6
feltsandwich,,,"This is why I'm not convinced that fruitarianism itself represents an eating disorder. It's a fantasy belief.

I had a coworker whose sister tried to treat her colon cancer with a fruitarian diet. I don't have to tell you how that went.",0,1719792976,,,0,lb20xf0,t3_1ds62lf,t1_lb1lhet,1719792992,17,False,therewasanattempt,t5_39ne7
MadLibrarian42,,,"I grew up knowing my maternal grandparents and my paternal grandfather very well. My maternal great-grandparents died when my mom was a kid. My paternal grandmother died of cancer when my dad was 13. Her family didn't like my grandfather (he was an alcoholic) and I found out a few years ago that the family talked about taking my dad to Nova Scotia (my dad was in Massachusetts) so he could be raised away from that. None of them wanted to take him and they basically abandoned him. I found out last year through genealogical research that my great-grandmother died when I was in college. Part of me is pissed I didn't even know she was alive. But for the most part, I'm fine with it and hope she went to her grave wondering whatever happened to her 13-year-old grandson (who married, raised four kids, and modeled the importance of a close-knit family).",0,1719793005,,,0,lb20zwx,t3_1dsbmf7,t3_1dsbmf7,1719793021,1,False,GenX,t5_2qur9
PeachPreserves66,,,"I was raised with proper manners, including how to address my elders.  So, it was second nature to use those manners when I worked my first corporate job after my six year stint of being a SAHM,  I was bored as one of three people to be “floaters” to fill in for various positions, as needed.  After the three month trial period, I was the only person hired as a permanent employee.  Very low level, bit a foot in the door.  Manners were cited as apart of their hiring decision.  I gave equal respect to customers and board members.

This gig has evolved over 40 years of increasing responsibility in core business aspects, the last 20 or so years in an IT perspective, supporting a business system.  Without the foundation of basic manners to get my foot in tje door, who knows where I would be now.  I’ve endured pissed off customers who called me very name in the book.  I learned not to take it personally.  Damn, that was hard sometimes.  I wept uncontrollably after a conversation with a borrower who lost her young daughter to childhood cancer.  I waived her late charges on the spot, not caring if I was written up. Empathy and manners go hand in hand in my book.

I also instilled manners in both of my kids.  Yes ma’am and no sir.  Best friends were Aunt Beth and Uncle Bob, Neighbors and others were Mr David and Miss Lynne.  Kind of a southern thing, I guess.  Sometimes, I thought they were wild feral children at home and despaired that they would not be prepared tor adulthood.  Until I weather to pick them up at daycare one day. The worker there gushed haw polite and respectful my kids were.  I pointed out my two hooligans and steeled myself to be shamed.  Well, it wasdefinitely ice cream night after dinner when the teacher affirmed that she was referring to my kids.",0,1719793184,,,0,lb21fdl,t3_1dqizjb,t3_1dqizjb,1719793201,1,False,AskOldPeople,t5_2yg69
lily_fairy,,,"honey and milk by flower face

family line by conan gray

cancer by my chemical romance",0,1719793276,,,0,lb21nc4,t3_1drgim5,t3_1drgim5,1719793293,1,False,musicsuggestions,t5_2tb5e
REC_HLTH,,,That’s okay. Everyone is different. My mom was 70 when she died and had cancer. All of my grandparents lived or are living into their 90s. I’m in my 40s and both of my mom’s parents are still living. We have the youngest of mom’s grandchildren and they are teens.,0,1719793352,,,0,lb21tsc,t3_1drze7w,t1_laz6hji,1719793367,1,False,Millennials,t5_2rc4u
gray_grey_,,,"I'm sorry you have to go through this. We could write books on how women have had their pain dismissed and belittled (the average time for endo diagnosis is what, 7 years or something ridiculous?). I know you said you don't have the same beliefs as your mom, and I disagree with her ""let go and let God"" in this instance. We don't tell people with cancer to just pray it away. Infertility is a medical diagnosis. And while I believe prayer is vital, God can use medical intervention to accomplish His plans. It irks me when people believe faith and science are interchangeable. And for your bonus, sadly - many of my friends and even family who I thought were the closest to me honestly just ended up ghosting me. Not everyone is equipped with the emotional maturity and most people suck at communication. The flip side is I really learned who I can depend on. Give yourself grace and space. I'm not saying to cut off your mom, but the things she has said and done don't sound like how you should be treated by a friend let alone your own mother. Don't be afraid to *not* include her in your world when you need a safe space.",0,1719793385,,,0,lb21wp8,t3_1dsez52,t3_1dsez52,1719793402,5,False,InfertilitySucks,t5_32qt5
IndyHCKM,,,"Yes definitely. I did a holistic approach only recently and it only led to more damage, even though I was pain free.

Biologics are not without risk. And i’ve perhaps dealt with some of those risks. But my life is 1,000% better on biologics than not.

Maybe if i get cancer or some other risk, i’ll feel differently. But it's still hard to argue that the years of quality life i got back from biologics weren’t worth it, even if i have some ultimately negative outcome.

Some things i’ve experienced: hoarse voice, tingly limbs, bloating, swollen ankle, tingly side of face, slight vision deterioration, moments of dizziness or disorientation, fatigue, persistent cough, saliva build up in my throat, etc.

But… i can go on runs now (i ran for over an hour last night), i can get in and out of bed on my own. I lift weights. I am not in constant pain. I sleep well. None of those things were true before biologics for me.",0,1719793431,,,0,lb220ms,t3_1dsf3u8,t1_lb1zfnl,1719793447,10,False,ankylosingspondylitis,t5_2tnlj
Rasputin_98,,,"Mihawk is canonically weaker than Old Whitebeard while Shanks its stated to be equal. And in this case this isn't vague, Mihawk admitted WB was stronger  by saying there was a gap between them. 


 Mihawk has never been portrayed to be that strong. Characters don't treat him like they do Shanks. Actually mihawk has 2 feats besides beating don KRIEG. He said there was a gap between him and cancer beard and then proceeds to POSTPONE a fight with old beard 5° commander. Sucking from shank's balls doesnt work when the author has portraied both characters differently

That title hardly matters when no one gives a shit about his title. He doesn't command respect in the same way Roger, Shanks,Whitebeard or Kaido do, the portrayal simply is very underwhelming. The only characters that hype him up are fodder, Zeff and Zoro. Shanks on the other side is hyped by Big Mom, Greenbull,  Kaido, Garp and the 5 elders

Can you imagine Marco sending Vista to stop Kaido? I can't see happening.  It's like Katakuri sending Perospero to stop Kaido. 
Mihawk= kuzan = kizaru",0,1719793451,,,0,lb222gc,t3_1dsf90o,t1_lb21qh9,1719793467,9,False,OnePiecePowerScaling,t5_34km3c
